{
    "category": "Milestone Institute of Arts and Sciences",
    "name": "Analytical and Logical Reasoning",
    "board": "milestone-institute-of-arts-and-sciences",
    "subject": "analytical-and-logical-reasoning",
    "url": "/milestone-institute-of-arts-and-sciences/analytical-and-logical-reasoning/2026/subject-mcqs",
    "country": "PK",
    "totalQuestions": 14,
    "questions": [
        {
            "id": 13348,
            "question_text": "If 'APPLE' is coded as 'BRQMF', how is 'ORANGE' coded?",
            "options": [
                "PSBOIF",
                "P SBOHF",
                "PSBOHF",
                "QSBNHF"
            ],
            "correct_answer_index": 2,
            "explanation": "The pattern involves shifting each letter forward by one (A->B, P->Q, etc.), except for the second letter which shifts by 2 (P->R). Actually, wait: A(+1)B, P(+2)R, P(+1)Q, L(+1)M, E(+1)F. Applying a consistent pattern of A+1=B, P+2=R, P+1=Q is likely too complex; checking standard shifts: A+1=B, P+2=R, P+1=Q. If we follow simple +1 for all, it doesn't fit. The sequence is +1, +2, +1, +1, +1. Following that: O+1=P, R+2=T? No. Let's look at the options: P-S-B-O-H-F. O+1=P, R+1=S, A+1=B, N+1=O, G+1=H, E+1=F.",
            "is_past_paper": false,
            "exam_source": "AI"
        },
        {
            "id": 13349,
            "question_text": "Pointing to a photograph, a man said, 'I have no brothers or sisters, but that man's father is my father's son.' Whose photograph was it?",
            "options": [
                "His own",
                "His father's",
                "His son's",
                "His nephew's"
            ],
            "correct_answer_index": 2,
            "explanation": "'My father's son' with no siblings is the man himself. So, the man is the father of the person in the photo. Therefore, it is his son.",
            "is_past_paper": false,
            "exam_source": "AI"
        },
        {
            "id": 13350,
            "question_text": "Find the odd one out: Car, Bus, Bicycle, Ship.",
            "options": [
                "Car",
                "Bus",
                "Bicycle",
                "Ship"
            ],
            "correct_answer_index": 3,
            "explanation": "A ship travels on water, while the others travel on land.",
            "is_past_paper": false,
            "exam_source": "AI"
        },
        {
            "id": 13351,
            "question_text": "If 'TABLE' is coded as 'UBCMF', how is 'CHAIR' coded?",
            "options": [
                "DIBJS",
                "DIJBS",
                "DIBIS",
                "DJBJS"
            ],
            "correct_answer_index": 0,
            "explanation": "Each letter is shifted one position forward in the alphabet.",
            "is_past_paper": false,
            "exam_source": "AI"
        },
        {
            "id": 13352,
            "question_text": "A man walks 5 km North, then 3 km East, then 5 km South. How far is he from his starting point?",
            "options": [
                "8 km",
                "5 km",
                "3 km",
                "13 km"
            ],
            "correct_answer_index": 2,
            "explanation": "The North and South movements cancel out, leaving him 3 km East of the start.",
            "is_past_paper": false,
            "exam_source": "AI"
        },
        {
            "id": 13353,
            "question_text": "Complete the series: 1, 4, 9, 16, 25, ...",
            "options": [
                "30",
                "32",
                "36",
                "49"
            ],
            "correct_answer_index": 2,
            "explanation": "The series represents squares of consecutive integers: 1^2, 2^2, 3^2, 4^2, 5^2, 6^2.",
            "is_past_paper": false,
            "exam_source": "AI"
        },
        {
            "id": 13354,
            "question_text": "If all roses are flowers and some flowers are red, which statement must be true?",
            "options": [
                "All roses are red.",
                "Some roses are red.",
                "Some red things are flowers.",
                "All flowers are roses."
            ],
            "correct_answer_index": 2,
            "explanation": "The overlap between 'red' and 'flowers' confirms that some red things are indeed flowers.",
            "is_past_paper": false,
            "exam_source": "AI"
        },
        {
            "id": 13355,
            "question_text": "In a row of students, Sarah is 10th from the left and 15th from the right. How many students are there?",
            "options": [
                "23",
                "24",
                "25",
                "26"
            ],
            "correct_answer_index": 1,
            "explanation": "Total = (Left + Right) - 1 = (10 + 15) - 1 = 24.",
            "is_past_paper": false,
            "exam_source": "AI"
        },
        {
            "id": 13356,
            "question_text": "If 'Friend' is 'Enemy', what is 'Success'?",
            "options": [
                "Failure",
                "Win",
                "Victory",
                "Effort"
            ],
            "correct_answer_index": 0,
            "explanation": "The question asks for the antonym of success.",
            "is_past_paper": false,
            "exam_source": "AI"
        },
        {
            "id": 13357,
            "question_text": "A clock shows 3:15. What is the angle between the hour and minute hands?",
            "options": [
                "0 degrees",
                "7.5 degrees",
                "15 degrees",
                "22.5 degrees"
            ],
            "correct_answer_index": 1,
            "explanation": "At 3:15, the minute hand is at 3, but the hour hand has moved past 3 by 15/60 * 30 degrees = 7.5 degrees.",
            "is_past_paper": false,
            "exam_source": "AI"
        },
        {
            "id": 13358,
            "question_text": "Which word does not belong: Tiger, Lion, Leopard, Cow?",
            "options": [
                "Tiger",
                "Lion",
                "Leopard",
                "Cow"
            ],
            "correct_answer_index": 3,
            "explanation": "Tiger, Lion, and Leopard are wild cats; a cow is a domestic bovine.",
            "is_past_paper": false,
            "exam_source": "AI"
        },
        {
            "id": 13359,
            "question_text": "If today is Monday, what day will it be 10 days from now?",
            "options": [
                "Wednesday",
                "Thursday",
                "Friday",
                "Saturday"
            ],
            "correct_answer_index": 1,
            "explanation": "10 days mod 7 = 3 days. Monday + 3 days = Thursday.",
            "is_past_paper": false,
            "exam_source": "AI"
        },
        {
            "id": 13360,
            "question_text": "If all 'Zorgs' are 'Gloops' and no 'Gloops' are 'Humans', which of the following is true?",
            "options": [
                "All 'Zorgs' are 'Humans'.",
                "Some 'Humans' are 'Zorgs'.",
                "No 'Zorgs' are 'Humans'.",
                "Some 'Gloops' are 'Zorgs'."
            ],
            "correct_answer_index": 2,
            "explanation": "Since all Zorgs are inside the Gloop category, and no Gloops intersect with Humans, Zorgs cannot intersect with Humans.",
            "is_past_paper": false,
            "exam_source": "AI"
        },
        {
            "id": 13361,
            "question_text": "Complete the sequence: 3, 7, 15, 31, 63, ...",
            "options": [
                "127",
                "125",
                "95",
                "130"
            ],
            "correct_answer_index": 0,
            "explanation": "The pattern is (previous number * 2) + 1. 63 * 2 + 1 = 127.",
            "is_past_paper": false,
            "exam_source": "AI"
        }
    ]
}
